url|originalTitle|translatedTitle|originalText|translatedText|originalShortText|translatedShortText|source|datePublished
http://fokus.mk/tsivil-ne-se-mozhni-slobodni-izbori/|ЦИВИЛ: Не се можни слободни избори|CIVIL: Not possible free elections|ЦИВИЛ денеска во 12 часот организира средба со граѓани и ќе одржи прес конференција пред Собранието на РМ. во нивниот повик се наведува дека на средбата, ЦИВИЛ ќе го сподели со јавноста ставот дека слободни избори не се можни на 5 јуни и дека владата треба да поднесе оставка поради неуспехот да го спроведе Договорот за надминување на политичката криза, потпишан во Пржино (2 јуни/15 јули 2015.), а со тоа оневозможи и создавање услови за одржување слободни избори во Република Македонија.„Со фантоми – НЕ! Со уцени – НЕ! Со насилство – НЕ! Со наши пари – НЕ! Со корупција – НЕ! Со лаги – НЕ!“, велат од ЦИВИЛ.|CIVIL today in the 12 o'clock arrange a meeting with citizens and will hold a press conference before the Assembly of the republic of MACEDONIA. in their call by stating that at the meeting, CIVIL will share with the public the position that free elections are not possible on the 5 June and that the government should resign because of the failure to implement the Agreement for overcoming the political crisis, signed in Пржино (2 June/15 July 2015.), and with it disable and create conditions for the holding of free elections in the Republic of Macedonia."With the phantoms – NOT! With the blackmail – NOT! With violence – NOT! With our money – NOT! With corruption – NOT! With lies – NOT!“, say from the CIVIL.|„Со фантоми – НЕ! Со уцени – НЕ! Со насилство – НЕ! Со наши пари – НЕ! Со корупција – НЕ! Со лаги – НЕ!“|"With the phantoms – NOT! With the blackmail – NOT! With violence – NOT! With our money – NOT! With corruption – NOT! With lies – NOT!“|Fokus|6 апр 2016, 09:29
http://fokus.mk/novo-zadolzhuvan-e-od-10-milioni-evra/|Ново задолжување од 10 милиони евра|New borrowing of 10 million euros|Државата денеска зема нови 10 милиони евра од банките и други домашни клиенти, пренесува Телма. На четирите закажани аукции на државни записи и обврзници, се бараа околу 12 милиони евра но  беа продадени хартии од вредност на три од нив.Според надлежното Министерство, клиентите и банките биле заинтересирани само за едногодишните записи и за 10 годишните обврзници. За 12 месечните записи, банките понудиле 8,8 милиони евра а останати клиенти за двете аукции на 10 годишни обврзници, понудиле вкупно 1,25 милиони евра.Вчера државата врати 4,8 милиони евра стари долгови, а утре треба да се вратат уште 7,15 милиони евра.|The country today takes a new 10 million euro from the banks and other domestic clients, transmit Telma. Of the four scheduled auctions of treasury bills and bonds, are asking for about 12 million but were sold securities in three of them.According to the competent line Ministry, clients and the banks were only interested in едногодишните bills and for the 10 annual bonds. For 12 monthly bills, the banks offered 8.8 million euros and other customers for the two auctions of 10-year bonds, offered a total of 1,25 million euros.Yesterday the state back 4,8 million euros old debts, and tomorrow I need to return yet 7,15 million.|Вчера државата врати 4,8 милиони евра стари долгови, а утре треба да се вратат уште 7,15 милиони евра.|Yesterday the state back 4,8 million euros old debts, and tomorrow I need to return yet 7,15 million.|Fokus|5 апр 2016, 20:31
http://fokus.mk/opozitsijata-e-podgotvena-za-izbori-na-koi-k-e-ima-promeni/|Опозицијата е подготвена за избори на кои ќе има промени|The opposition is ready for elections, that there will be change|СДСМ и коалициските партнери едногласно заклучија дека се подготвени за избори во секој момент на кои што постои цврста убеденост дека промени ќе се случат, но дека обврска на сите институции и политички субјекти е во Република Македонија да се спроведат фер и регуларни избори, се вели во соопштението по средбата на претседателот на СДСМ, Зоран Заев, придружуван од генералниот секретар на СДСМ и министер за внатрешни работи, Оливер Спасовски со партнерите од здружената опозиција.-Без прочистен Избирачки список не може да бидат организирани и спроведени фер и регуларни избори. Оттука СДСМ и коалициските партнери очекуваат реална оценка од Државната изборна комисија која што ја има одговорноста за доверлив Избирачки список, се вели во соопштението од СДСМ.СДСМ и коалициските партери потсетуваат дека неколку изборни циклуси по ред во Република Македонија се спроведуваат нерегуларни избори, на кои што не се почитува изборната волја на граѓаните на Република Македонија, што нанесува непоправливи штети како на граѓаните така и на интеграциите на државата на меѓународен план.|SDSM and ruling coalition, he partners unanimously concluded that they are ready for elections at any moment of which there is a solid убеденост that changes will happen, but that the obligation of all institutions and political subjects in the Republic of Macedonia to conduct a fair and regular elections, said in a statement after the meeting of president of SDSM, Zoran Zaev, accompanied by the secretary general of SDSM, and the minister of the interior, Oliver Spasovski with partners from здружената opposition.-Without purified Voter register may not be organized and conducted fair and regular elections. Therefore, the SDSM and ruling coalition, he partners expect a realistic assessment from the State election commission which has the responsibility for the confidential Voter list, said in a statement from the SDSM.SDSM and ruling coalition, he партери remind you that a few election cycles in a row in the Republic of Macedonia are conducted irregular elections, which do not respect the electoral will of the citizens of the Republic of Macedonia, which applied непоправливи damages as of the citizens and of the integration of the state at the international level.|„Без прочистен Избирачки список не може да бидат организирани и спроведени фер и регуларни избори. Оттука СДСМ и коалициските партнери очекуваат реална оценка од Државната изборна комисија.“|"Without purified Voter register may not be organized and conducted fair and regular elections. Therefore, the SDSM and ruling coalition, he partners expect a realistic assessment from the State election commission.“|Fokus|5 апр 2016, 19:28
http://fokus.mk/tortevski-se-shto-dosega-sum-kazhal-za-sjo-e-rezultat-na-moite-lichni-ubeduvan-a/|Тортевски:  Се што досега сум кажал за СЈО е резултат на моите лични убедувања|Тортевски: everything so far I'm told for СЈО is the result of my personal beliefs|Адовокатот Александар Тортевски денеска ги демантира пишувањата на повеќе провладини медиуми кои деновиве објавуваа дека за неговите јавни настапи тој бил плаќан од Специјалното јавно обвинителство.-Категорички изјавувам дека од СЈO немам добиено ниту еден денар, ниту сум бил во нивните простории, ниту знам каде се наоѓаат. Се што досега сум кажал за СЈО е резултат на моите лични убедувања и на мојата совест. Инаку, навистина ми е жал што не сум дел од тимот на СЈО и доколку тие проценат дека можам да им бидам од било каква полза, тогаш сигурно ќе прифатам, вели Тортевски во демантот.Тој додава дека доколку се утврди дека земал хонорар од Специјалното јавно обвинителство, тогаш тој износ стократно зголемен ќе го даде како помош на угнетувани новинари.-Во однос на наводно досега добиените хонорари од СЈО доколку се утврди дека сум добил такви средства, јавно изјавувам дека износот кој ќе се открие стократно зголемен ќе го исплатам за помош на угнетувани новинари кои мора да пишуваат во списанија кои никој не ги купува. Со оглед дека Канал 5 ја пренесе оваа вест дури можам износот да го уплатам на сметката на нивните сопственици во Панама, вели адвокатот Тортевски.|Адовокатот Alexander Тортевски today did not deny the reports sound more провладини media will објавуваа that for his public appearances he was плаќан from the Special public prosecutors.-Explicitly I declare that from СЈО I have received neither a penny nor I had been in their rooms, nor do I know where are located. Everything so far I'm told for СЈО is the result of my personal convictions and my conscience. Otherwise, I really sorry that I'm not part of the team of СЈО and if they assess that I can't be of any benefit, then you certainly will accept them, said Тортевски in демантот.He added that if found that taking a fee from the Special public prosecutor's office, then he the amount a hundredfold increased'll give as the help of угнетувани journalists.-In respect of the alleged hitherto received allowances from the СЈО if it is established that I have received such funds, publicly I hereby declare that the amount which will reveal a hundredfold increased will исплатам for the help of угнетувани journalists who have to write in journals that no one buys. Given that the Channel 5 convey this news even I can amount to уплатам on the account of their owners in Panama, says the lawyer Тортевски.|Инаку, навистина ми е жал што не сум дел од тимот на СЈО и доколку тие проценат дека можам да им бидам од било каква полза, тогаш сигурно ќе прифатам, вели Тортевски во демантот.|Otherwise, I really sorry that I'm not part of the team of СЈО and if they assess that I can't be of any benefit, then you certainly will accept them, said Тортевски in демантот.|Fokus|5 апр 2016, 19:19
http://fokus.mk/ahmeti-dui-nema-da-padne-na-montirani-materijali/|Ахмети: ДУИ нема да падне на монтирани материјали|Ahmeti: DUI is not going to fall out of the mounted materials|ДУИ и Албанците нема да дозволат да бидат жртва на било какви монтирани материјали, истакнал претседателот на ДУИ, Али Ахмети, на средбата со Директорот на Директоратот за проширување во Европската комисија, Кристијан Даниелсон.Ахмети истакнал дека со протечените снимки за високи функционери од ДУИ кои се однесуваат на приватниот живот на политичарите, целта била во соработка со криминални групи, кои се обидуваат да поттикнат ирационални постапки на ДУИ, да го оштетат процесот на спроведување на Договорот од Пржино.Ахмети и  Даниелсон разговарале и за актуелната ситуација во земјата, безбедносната ситуација, спроведувањето на Договорот од Пржино, за интеграцијата во Европската Унија, реформите и меѓуетничките односи.|DUI and the Albanians will not allow to be a victim of any mounted materials, has pointed out the president of DUI, Ali Ahmeti, at the meeting with the Director of the Directorate for enlargement in the European commission, Christian Даниелсон.Ahmeti has pointed out that with the протечените shots for high-ranking officials from the DUI, which refer to private life of politicians, the goal was, in cooperation with the criminal groups, who are trying to incite irrational procedures of DUI, the damage process of the implementation of the Treaty of Пржино.Ahmeti and Даниелсон have talked and about the current situation in the country, the security situation, the implementation of the Treaty of Пржино, for integration into the European Union, reforms and inter-ethnic relations.|ДУИ и Албанците нема да дозволат да бидат жртва на било какви монтирани материјали, истакнал претседателот на ДУИ, Али Ахмети, на средбата со Директорот на Директоратот за проширување во Европската комисија, Кристијан Даниелсон.|DUI and the Albanians will not allow to be a victim of any mounted materials, has pointed out the president of DUI, Ali Ahmeti, at the meeting with the Director of the Directorate for enlargement in the European commission, Christian Даниелсон.|Fokus|5 апр 2016, 18:50
http://fokus.mk/po-protestite-premierot-na-island-si-podnese-ostavka/|По протестите премиерот на Исланд си поднесе оставка|After the protests the prime minister of Iceland you resign|Премиерот на Исланд, Сигмундур Дејвид Гунлаугсон, денеска по масовните протести на граѓаните, си поднесе оставка. Граѓаните бараа оставка од премиерот откако во јавноста излегоа документи за оф-шор бизнисте од Панама.Гунлаугсон се обидуваше да остане на функцијата барајќи од претседателот на земјата да го распушти Парламентот и да распише предвремени избори, но откако идејата беше отфрлена од исландскиот претседател, Гунлаугсон реши да се повлече од премиерската функција.Тој сега останува на лидер на Прогресивната партија во Исланд, а на местото на премиер доаѓа  Сигурдур Инги Јохансон, досегашен министер за земјоделство и рибарство.|The prime minister of Iceland, Сигмундур David Гунлаугсон, today, after the mass protests of citizens, you're resigned. The citizens demanded the resignation of the prime minister after the public came to the documents for the offshore бизнисте from Panama.Гунлаугсон tried to stay on as the demanding from the president of the country to dissolve Parliament and convene early elections, but after the idea was rejected by the исландскиот president, Гунлаугсон decided to withdraw as prime minister function.He now remains of the leader of the Progressive party in Iceland, and of the place of the prime minister comes Сигурдур Инги Johansson, a previous minister for agriculture and fisheries.|Премиерот на Исланд, Сигмундур Дејвид Гунлаугсон, денеска по масовните протести на граѓаните, си поднесе оставка. Граѓаните бараа оставка од премиерот откако во јавноста излегоа документи за оф-шор бизнисте од Панама.|The prime minister of Iceland, Сигмундур David Гунлаугсон, today, after the mass protests of citizens, you're resigned. The citizens demanded the resignation of the prime minister after the public came to the documents for the offshore бизнисте from Panama.|Fokus|5 апр 2016, 17:55
http://fokus.mk/noviot-minister-za-obrazovanie-ja-prezema-funktsijata/|Новиот министер за образование ја презема функцијата|The new minister for education takes over the function|Пиштар Лутфиу, новоименуваниот министер за образование и наука, денеска и официјално ја презема функцијата од досегашниот министер, Абдулаќим Адеми.-Ќе продолжиме да ја имплементираме програмата на Владата во областа на образованието и науката. Тоа што е зацртано е амбициозна програма, бара многу напори, финансиски средства и соработка. Се надевам дека како и со досегашната динамика со која работевме како Влада ќе продолжиме и понатаму, рече Латфиу.Тој е  роден 1986 година во Скопје. Работел во Секретаријатот за спроведување на Рамковниот договор (2013), а бил генерален секретар и на Институтот за политички и меѓународни студии. Магистрирал во 2012 година на Штуловиот универзитет во областа на политичките науки. |Пиштар Лутфиу, the newly appointed minister for education and science, today officially takes over the function of the former minister, Abdulaqim Ademi.-We will continue to implement the Government programme in the field of education and science. It is written out is an ambitious program, requires a lot of efforts, financial resources and cooperation. I hope that as with the previous dynamics with which we as a Government will continue and further, the said Латфиу.He was born 1986 in Skopje. Worked in the Secretariat for the implementation of the Framework agreement (2013), and was the general secretary and of the Institute for political and international studies. A master's degree in 2012 year of the Штуловиот university in the field of political science. |Работел во Секретаријатот за спроведување на Рамковниот договор (2013), а бил генерален секретар и на Институтот за политички и меѓународни студии. Магистрирал во 2012 година на Штуловиот универзитет во областа на политичките науки.|Worked in the Secretariat for the implementation of the Framework agreement (2013), and was the general secretary and of the Institute for political and international studies. A master's degree in 2012 year of the Штуловиот university in the field of political science.|Fokus|5 апр 2016, 17:04
http://fokus.mk/denielson-ostanuva-ushte-mnogu-rabota-za-verodostojni-izbori/|Дениелсон: Останува уште многу работа за веродостојни избори|Дениелсон: Remains still a lot of work for credible elections|Одложувањето на изборите овозможи дополнително време за да се постигне напредок, но сепак останува уште многу работа да се заврши за веродостоен изборен процес, изјави генералниот директор на Директоратот за проширување на ЕК Кристијан Даниелсон на денешната прес конференција во Скопје по средбите со лидерите на четирите партии потписнички на Пржинскиот договор, како и со премиерот Емил Димитриев.- Сите партии и државни институции да работат заедно, со цел да се обезбедат веродостојни избори и да учествуваат во изборниот процес. Веродостоен и добар изборен процес е клучен елемент за да се вратите на патот на евроатлантскиот пат. Ги охрабрувам сите чинители и државни институции да ја поддржат работата на ДИК во прочистувањето на Избирачкиот список. Тоа ќе придонесе за враќањето на довербата на граѓаните во овој процес – рече Даниелсон.|The delay of the elections allow for extra time to progress, however there remains still a lot of work to be completed for a credible election process, said the general director of the Directorate for enlargement of the EC, Christian Даниелсон of today's press conference in Skopje after the meeting with the leaders of the four parties signatory to Пржинскиот agreement, as well as with prime minister Emil Димитриев.- All parties and state institutions to work together, in order to ensure credible elections and to participate in the electoral process. Reliable and a good electoral process is a key element to return to the path of the euro-atlantic path. I encourage all stakeholders and government institutions to support the work of the SEC in прочистувањето of the Voters list. This will contribute to restoring the trust of the citizens in this process, " said Даниелсон.|Тоа е клучен елемент за да се вратите на патот на евроатлантскиот пат, порача Директоратот за проширување на ЕК.|It is a key element to return to the path of the euro-atlantic path, addressed the Directorate for the enlargement of the EC.|Fokus|5 апр 2016, 15:26
