url|originalTitle|translatedTitle|originalText|translatedText|originalShortText|translatedShortText|source|datePublished
http://www.telma.com.mk/vesti/pochnuva-so-rabota-novata-bolnica-na-d-r-zhan-mitrev|Почнува со работа новата болница на д-р. Жан Митрев|It begins with the work of the new hospital dr. Jean Митрев|Првата кардиоваскуларна операција во новата болница „Филип Втори“, ќе биде направена денеска, од страна на д-р Жан Митрев и неговиот тим. Сите досегашни услуги кои се нудеа во изминативе 16 години пациентите ќе имаат можност да ги добијат и во новата болница.Ќе биде потпишан и договор помеѓу Хрватскиот авионски оператор „Аир – Панонија“, кој врши медицински транспорт на пациенти низ светот со 11 авиони, со што, специјалната болница „Филип Втори“ ќе им овозможи на пациентите во еден ден транспорт, дијагноза и оперативен зафат. Со ова, според Митрев,  болницата отвора и нова страница во развојот на македонскиот медицински туризам, но и во извозот на македонското медицинско знаење во земјите на Европската унија.|The first cardiovascular operation in the new hospital "Philip Ii" will be made today, by dr Jean Митрев and his team. All of these services that are offered in the past 16 years, patients will have the opportunity to get and in the new hospital.Will be signed and the agreement between the Croatian air carrier "Calamus – Панонија", which performs medical transport of patients around the world with 11 aircraft, with that, the special hospital "Filip Ii" will allow patients in a single day transport, diagnosis and operative surgery. With this, according to the Митрев, the hospital opens a new page in the development of the Macedonian medical tourism, but also in the export of the Macedonian medical knowledge in the countries of the European union.|||Telma|2016-04-11 13:10
http://www.telma.com.mk/vesti/mnr-incidentot-so-migrantite-kaj-idomeni-pottiknat-od-nvo-aktivisti|МНР: Инцидентот со мигрантите кај Идомени поттикнат од НВО активисти|MFA: the Incident with the migrants in Идомени prompted by NGO activists|Организираните масовни и координирани обиди за илегален премин на границата, што се случија вчера, според многу аспекти, вклучувајќи ја и вмешаноста на активисти на невладини организации, имаат карактеристики и наликуваат на сличниот инцидент за масовно илегално преминување на границата од 14 март годинава во кој беа инволвирани 2.500 мигранти.Ова се вели во соопштението на Министерството за надворешни работи во врска со вчерашниот инцидент на македонско-грчката граница кај Идомени во кој беа повредени 23 припадници на македонските безбедносни сили кои спречија над 3.000 мигратни насилно да влезат од Грција на македонска територија. - Различни извештаи говорат дека во обидот да ја поминат грчко-македонската граница со употреба на насилство мигрантите биле поттикнати, заведени и организирани од активисти на невладини организации. Било регистрирано и дистрибуирање на летоци кои содржеле лажни информации дека штом мигрантите успеат да ја поминат грчко-македонската граница со употреба на насилство тие ќе можат непречено да го продолжат својот пат до земјите членки на ЕУ, се посочува во соопштенеито.Според МНР, македонските безбедносни сили, заедно со полициски службеници од неколку земји членки на ЕУ кои се распоредени на јужната граница, согласно Програмата за соработка на ЕУ и Македонија за поддршка на менаџирањето на границата заради справување со мигрантската криза, одговорија брзо и согласно ситуацијата и спречија нелегален влез. Притоа наведуваат дека не е повреден ниту еден од мигрантите кои учествуваа во насилните протести.- Употребен е солзавец со цел да се растури насилната група. Не се употребени никакви други средства на контрола, ниту физичка сила против групата. Дваесет и тројца припадници на македонските сили се повредени за време на инцидентот. Воедно, ниту еден од извршителите не е повреден на македонска територија. Утврдени се неколку оштетувања на граничната ограда, се посочува во соопштението.Се посочува дека македонските власти побарале вклучување на грчките полициски сили во услови кога постојано се случуваат насилни напади од грчката територија.- Постојано се упатуваат барања за соработка и размена на информации со цел превентивно да се делува во однос на насилните протести на мигрантите и обидите за илегален премин од Грција на македонска територија. Воспоставувањето ред и мир во пограничната зона, како и во и околу центрите за прифаќање мигранти е од суштествено значење за превенирање вакви инциденти во иднина, се нагласува во соопштението од македонското МНР.Инаку, ситуацијата на граничниот камен 59, се посочува, е вратена во нормала во 18 часот и 30 минути и во моментов е мирно.Обидот за илегален влез се случи вчера околу 10:50 часот на граничната линија помеѓу Македонија и Грција кај граничниот камен 59. Во инцидентот се проценува дека учествувале над 3.000 мигранти организирани во помали и поголеми групи во обид насилно да влезат на територија на Македонија од Грција кај нелегалниот граничен премин кај каменот 59. Сличен инцидент за масовно илегално преминување на границата се случи на грчко-македонската граница на 14 март годинава кај селото Моин во кој беа инволвирани 2.500 мигранти.  |The organized massive and coordinated attempts for illegal crossing of the border, that took place yesterday, according to many aspects, including the involvement of activists of non-governmental organizations, have the features and looks like a similar incident of mass illegal crossing of the border by the 14 march this year in which were involved about 2500 migrants.This is stated in the press release of the Ministry of foreign affairs in connection with yesterday's incident on the Macedonian-Greek border in Идомени in who were injured 23 members of the Macedonian security forces which prevented over 3.000 мигратни forcibly to enter Greece on the Macedonian territory. - Various reports suggest that in the attempt to pass the Greek-Macedonian border with the use of violence, the migrants were solicited, recorded and organized by the activists of non-governmental organizations. Any registered, and the distribution of leaflets that содржеле false information that as soon as the migrants fail to pass the Greek-Macedonian border with the use of violence, they will be able to smoothly continue its path to the EU member states, the states in the соопштенеито.According to the MFA, the Macedonian security forces along with police officers from several member states of the EU that are deployed on the southern border, according to the Program of cooperation of the EU and Macedonia for the support of the management of the border for dealing with мигрантската crisis, responded quickly and according to the situation and prevented the illegal entry. It stated that it is not hurt none of the migrants who participated in the violent protests.- Used a lachrymatory in order to break up the насилната group. Not used any other means of control, nor physical force against the group. Twenty-three members of the Macedonian forces were injured during the incident. At the same time, none of the executors is not injured on the Macedonian territory. There are several damage to the border fence, stated in a statement.Indicates that the Macedonian authorities requested the involvement of Greek police forces in the conditions when the constantly occurring violent attacks of the Greek territory.- Constantly refer requests for cooperation and exchange of information in order preemptively to act in relation to the violent protests of the migrants and the attempted illegal crossing from Greece on the Macedonian territory. Establishing peace and order in the border zone, as well as in and around the centres for the acceptance of migrants is essential to prevent such incidents in the future, stresses in a statement from the Macedonian MFA.Otherwise, the situation on the border stone 59, states, is restored to normal in 18 hours and 30 minutes and it is currently quietly.The attempt of the illegal entry happened yesterday around 10:50 pm on the border line between Macedonia and Greece in the border stone 59. In the incident are estimated to have participated over 3.000 migrants organized in smaller and larger groups in an attempt forcibly to enter on the territory of Macedonia from Greece in the illegal border crossing in the stone 59. A similar incident of mass illegal crossing of the border happened on the Greek-Macedonian border, on 14 march this year in the village Моин in which were involved about 2500 migrants. |||Telma|2016-04-11 11:16
http://www.telma.com.mk/vesti/grchkiot-pretsedatel-so-zhestoka-kritika-za-makedonija-poradi-incidentite-na-idomeni|Грчкиот претседател со жестока критика за Македонија поради инцидентите на Идомени|The Greek president with fierce criticism for Macedonia because of the incidents of Идомени|Грчкиот претседател Прокопис Павлопулос остро ги осуди инцидентите на Идомени и оцени дека со насилниот однос кон бегалците Македонија покажала дека не заслужува да биде членка ниту на ЕУ ниту на НАТО. Павлопулос на денешната средба со португалскиот премиер Антонио Коста говореше за начините на кои ЕУ треба да се справи со бегалската криза и го искористи моментот повторно да упати критика и напад кон Македонија околу прашањето.„Соседните држави и тука конкретно мислам на Поранешната југословенска република Македонија кои имаат амбиции да влезат во ЕУ и НАТО кога се однесуваат кон бегалците како што се однесуваа вчера тука во Грција, со однос кој е незамислив, неприфатлив за хуманизмот, јасно е дека не им е местото ниту во ЕУ ниту секако во НАТО“, истакна Павлопулос.Грчкиот претседател потенцираше дека членките на ЕУ мора да се однесуваат хумано и солидарно кон бегалците бидејќи бегалската криза во моментов е најкритичниот и егзистенцијален проблем на Унијата. Упати критика и кон извесни ЕУ држави дека на проблемот наместо солидарно и хумано, реагирале со неоснована фобија кон проблемот, коментирајќи дека ако нема солидарност кон бегалците тогаш ЕУ ќе се врати многу чекори назад во сите полиња на кои има направено напредок. |The Greek president Прокопис Павлопулос sharply condemned the incidents of Идомени and evaluate that with the violent attitude towards refugees, Macedonia has shown that there deserves to be a member neither of the EU nor of NATO. Павлопулос of today's meeting with the Portuguese prime minister Antonio Costa spoke about the ways in which the EU should deal with the refugee crisis and used the moment to re-refer the criticism and attack towards Macedonia on the issue."Neighboring states and here in particular I think of the Former yugoslav republic of Macedonia who have ambitions to enter the EU and NATO when referring to the refugees as they are referred to yesterday here in Greece, with the respect which is незамислив, unacceptable to humanism, it is clear that there is place neither in the EU nor, certainly, in NATO," said Павлопулос.The Greek president emphasized that the EU members have to behave humanely and solidarity towards the refugees, because the refugee crisis is currently најкритичниот and егзистенцијален problem of the Union. Refer the reviews and to certain EU countries that the problem instead of solidarity and humane, reacted with the unfounded phobia to the problem, commenting that if there is not solidarity towards the refugees, the then EU will be back many steps back in all the fields of the who has made progress. |||Telma|2016-04-11 10:58
http://www.telma.com.mk/vesti/demokratski-sojuz-reshenijata-na-vladata-se-sprotivni-na-ustavot|Демoкратски сојуз: Решенијата на Владата се спротивни на Уставот|Democratic alliance: the Decisions of the Government are contrary to the Constitution|Повеќе од јасно е дека на 5 јуни нема да има избори, поради што Демократскиот сојуз ги повикува министрите и замениците министри, да ги повлечат оставките и да продолжат да работат со полн капацитет.Воедно Демократскиот сојуз предупредува на можните безбедносни проблеми доколку во МВР се наруши принципот на хиерархија и натаму се практикува паралелно дејствување од дополнителниот заменик министер. Поради ова, ДС бара, Владата да ги повлече поединечните кадровски решенија бидејќи тие ќе предизвикаат целосен хаос и парализа на највиталната институција. Овие решенија се спротивни на Уставот и законите поради што треба Уставниот суд со времена мерка да ги суспендира и сите решенија на Владата да ги поништи.Република Македонија е во криза и затоа повикуваме на политички дијалог и договор, реактивирање на Парламентот и деблокирање на другите институции, за да се спроведат реформи, кадровски промени и создадат услови за избори.|More than clear is that on June 5 there will be no elections, due to which the Democratic alliance calls upon the ministers and deputy ministers, to withdraw оставките and continue to operate with full capacity.At the same time, the Democratic union warns of possible security problems, if the ministry of the INTERIOR, disturb the principle of the hierarchy and continue to be practiced parallel action of the additional deputy minister. Because of this, DS requires, the Government to withdraw the individual staffing solutions because they will cause complete chaos and paralysis of the највиталната institution. These solutions are the opposite of the Constitution and the laws because you have the Constitutional court with the interim measure to suspend all the solutions of the Government to annul.The republic of Macedonia is in crisis and therefore we call for political dialogue and agreement, reactivate the Parliament and unblock of other institutions, to carry out reforms, personnel changes and create conditions for elections.|||Telma|2016-04-11 10:54
http://www.telma.com.mk/vesti/dvajca-visoki-pretstavnici-na-pjongjang-izblegale-vo-juzhna-koreja|Двајца високи претставници на Пјонгјанг изблегале во Јужна Кореја|Two high officials of the Пјонгјанг изблегале in South Korea|Владата на Јужна Кореја соопшти денеска дека двајца високи севернокорејски претставници, меѓу кои и полковникот на војната агенција за разузнавање на Сеул, пребегале во таа земја минатата година.Министерството за обединување и Министерството за одбрана на Јужна Кореја тврдат дека полковникот на севернокорејската војска дезертирал минатата година и оти му е одобрен политички азил. Министерството со обединување наведе дека висок претставник на Пјонгјанг, кој работел во една од африканска земја, побегнал во Јужна Кореја со своето семејство минатата година. Сеул во петокот објави дека група од 13 работници од ресторан во Северна Кореја во странство побегнале во Јужна Кореја. Тоа е најголемото групно дезертирање од кога севернокорејскиот лидер Ким Џонг Ун дојде на власт во 2011 година. Околу 29.000 Севернокорејци ја напуштија земјата и заминаа во Јужна Кореја од завршувањето на Корејската војна, покажуваат податоците на јужнокорејската Влада.|The government of South Korea announced today that two high севернокорејски officials, among which and colonel of the war agency for the intelligence of Seoul, пребегале in that country last year.The ministry of unification and the Ministry of defense of South Korea claim that the colonel of the Korean army дезертирал last year and that he is granted political asylum. Ministry with the unification state that the high representative of the Пјонгјанг, who worked in one of the african country, fled to South Korea with his family last year. Seoul announced Friday that a group of 13 workers from a restaurant in North Korea abroad had fled to South Korea. It is the largest group дезертирање from when севернокорејскиот leader Kim Џонг Un came to power in 2011. Around 29.000 north koreans left the country and went to South Korea since the end of the Korean war, show the data of the south Korean Government.|||Telma|2016-04-11 10:11
